{
  "formatVersion": 1,
  "logicalPartitionCounts": [1, 8, 32],
  "projectionParallelism": [1, 4, 16],
  "reducerCounts": [1, 3, 8],
  "forcedEvents": [
    "projection_retry",
    "duplicate_completion_index",
    "projection_node_loss",
    "reducer_retry",
    "reducer_node_loss",
    "coordinator_restart",
    "out_of_order_completion"
  ],
  "compare": {
    "canonicalSource": true,
    "dictionary": true,
    "semanticContentHash": true,
    "semanticSnapshotArtifacts": true,
    "certifiedQueryMultisets": true
  }
}
